[
  {
    "id": "200",
    "name": "OK",
    "class": "success",
    "description": "The request succeeded."
  },
  {
    "id": "201",
    "name": "Created",
    "class": "success",
    "description": "The request succeeded and created a resource."
  },
  {
    "id": "301",
    "name": "Moved Permanently",
    "class": "redirect",
    "description": "The resource has a new permanent URL."
  },
  {
    "id": "400",
    "name": "Bad Request",
    "class": "client-error",
    "description": "The server cannot process the request."
  },
  {
    "id": "401",
    "name": "Unauthorized",
    "class": "client-error",
    "description": "Authentication is required or invalid."
  },
  {
    "id": "404",
    "name": "Not Found",
    "class": "client-error",
    "description": "The requested resource was not found."
  },
  {
    "id": "500",
    "name": "Internal Server Error",
    "class": "server-error",
    "description": "The server encountered an unexpected condition."
  }
]
